views,retweets,quotes,likes,bookmarks,tweet,profile_picture,name,profile_handle,profile_url,tweet_timing,tweet_date,tweet_id,tweet_url
13.8K,"1,738",64.3K,26,26,Democrats in the Senate are still slow walking hundreds of highly qualified people wanting to come into government. Never been such an abuse in our country’s history. Mitch should not let Senate go home until all are approved. We need our Ambassadors and all others NOW!,https://pbs.twimg.com/profile_images/874276197357596672/kUuht00m_normal.jpg,Donald J. Trump,@realDonaldTrump,https://www.twitter.com/realDonaldTrump,4:24 AM,"Feb 17, 2019",1097109575248068608,https://www.twitter.com/realDonaldTrump/status/1097109575248068608
13.7K,"2,149",73.1K,37,37,"There is far more ENERGY on the Right than there is on the Left. That’s why we just won the Senate and why we will win big in 2020. The Fake News just doesn’t want to report the facts. Border Security is a big factor. The under construction Wall will stop Gangs, Drugs and Crime!",https://pbs.twimg.com/profile_images/874276197357596672/kUuht00m_normal.jpg,Donald J. Trump,@realDonaldTrump,https://www.twitter.com/realDonaldTrump,9:52 AM,"Feb 23, 2019",1099366469010366464,https://www.twitter.com/realDonaldTrump/status/1099366469010366464
12.6K,"1,666",73.7K,55,55,Since my election as President the Dow Jones is up 43% and the NASDAQ Composite almost 50%. Great news for your 401(k)s as they continue to grow. We are bringing back America faster than anyone thought possible!,https://pbs.twimg.com/profile_images/874276197357596672/kUuht00m_normal.jpg,Donald J. Trump,@realDonaldTrump,https://www.twitter.com/realDonaldTrump,7:12 AM,"Feb 25, 2019",1100050798015401984,https://www.twitter.com/realDonaldTrump/status/1100050798015401984
17.8K,"5,091",106.9K,199,199,"“(Crooked) Hillary Clinton confirms she will not run in 2020, rules out a third bid for White House.” Aw-shucks, does that mean I won’t get to run against her again? She will be sorely missed!",https://pbs.twimg.com/profile_images/874276197357596672/kUuht00m_normal.jpg,Donald J. Trump,@realDonaldTrump,https://www.twitter.com/realDonaldTrump,2:18 PM,"Mar 5, 2019",1103057225910755329,https://www.twitter.com/realDonaldTrump/status/1103057225910755329
"8,228",789,47.8K,27,27,"Aluminum prices are down 12% since I instituted Tariffs on Aluminum Dumping - and the U.S. will be taking in Billions, plus jobs. Nice!",https://pbs.twimg.com/profile_images/874276197357596672/kUuht00m_normal.jpg,Donald J. Trump,@realDonaldTrump,https://www.twitter.com/realDonaldTrump,12:45 PM,"Mar 8, 2019",1104121030862237696,https://www.twitter.com/realDonaldTrump/status/1104121030862237696
10.3K,905,51.7K,36,36,GDP growth during the four quarters of 2018 was the fastest since 2005. This Administration is the first on record to have experienced economic growth that meets or exceeds its own forecasts in each of its first two years in office. GROWTH is beating MARKET EXPECTATIONS!,https://pbs.twimg.com/profile_images/874276197357596672/kUuht00m_normal.jpg,Donald J. Trump,@realDonaldTrump,https://www.twitter.com/realDonaldTrump,9:00 AM,"Mar 18, 2019",1107673256268623872,https://www.twitter.com/realDonaldTrump/status/1107673256268623872
19K,"2,622",109.3K,101,101,"Amazingly, CNN just released a poll at 71%, saying that the economy is in the best shape since 2001, 18 years! WOW, is CNN becoming a believer?",https://pbs.twimg.com/profile_images/874276197357596672/kUuht00m_normal.jpg,Donald J. Trump,@realDonaldTrump,https://www.twitter.com/realDonaldTrump,2:28 PM,"Mar 19, 2019",1108118176754208771,https://www.twitter.com/realDonaldTrump/status/1108118176754208771
"9,484","1,504",52.9K,38,38,"Had the Fed not mistakenly raised interest rates, especially since there is very little inflation, and had they not done the ridiculously timed quantitative tightening, the 3.0% GDP, & Stock Market, would have both been much higher & World Markets would be in a better place!",https://pbs.twimg.com/profile_images/874276197357596672/kUuht00m_normal.jpg,Donald J. Trump,@realDonaldTrump,https://www.twitter.com/realDonaldTrump,2:41 PM,"Mar 29, 2019",1111745178824511489,https://www.twitter.com/realDonaldTrump/status/1111745178824511489
13K,"1,254",71.4K,52,52,"Robert Mueller was a Hero to the Radical Left Democrats, until he ruled that there was No Collusion with Russia (so ridiculous to even say!). After more than two years since the “insurance policy” statement was made by a dirty cop, I got the answers I wanted, the Truth.....",https://pbs.twimg.com/profile_images/874276197357596672/kUuht00m_normal.jpg,Donald J. Trump,@realDonaldTrump,https://www.twitter.com/realDonaldTrump,3:31 PM,"Mar 29, 2019",1111757883568463872,https://www.twitter.com/realDonaldTrump/status/1111757883568463872
13.2K,"1,758",65.6K,45,45,"Robert Mueller was a God-like figure to the Democrats, until he ruled No Collusion in the long awaited $30,000,000 Mueller Report. Now the Dems don’t even acknowledge his name, have become totally unhinged, and would like to go through the whole process again. It won’t happen!",https://pbs.twimg.com/profile_images/874276197357596672/kUuht00m_normal.jpg,Donald J. Trump,@realDonaldTrump,https://www.twitter.com/realDonaldTrump,5:46 AM,"Apr 2, 2019",1113060131917479936,https://www.twitter.com/realDonaldTrump/status/1113060131917479936
11.9K,"2,441",69K,61,61,I was never planning a vote prior to the 2020 Election on the wonderful HealthCare package that some very talented people are now developing for me & the Republican Party. It will be on full display during the Election as a much better & less expensive alternative to ObamaCare...,https://pbs.twimg.com/profile_images/874276197357596672/kUuht00m_normal.jpg,Donald J. Trump,@realDonaldTrump,https://www.twitter.com/realDonaldTrump,6:26 AM,"Apr 3, 2019",1113432687757484032,https://www.twitter.com/realDonaldTrump/status/1113432687757484032
"8,172",579,43.9K,17,17,We have redeployed 750 agents at the Southern Border’s specific Ports of Entry in order to help with the large scale surge of illegal migrants trying to make their way into the United States. This will cause traffic & commercial delays until such time as Mexico is able to use....,https://pbs.twimg.com/profile_images/874276197357596672/kUuht00m_normal.jpg,Donald J. Trump,@realDonaldTrump,https://www.twitter.com/realDonaldTrump,4:33 PM,"Apr 6, 2019",1114672393773912064,https://www.twitter.com/realDonaldTrump/status/1114672393773912064
10.3K,"1,313",53.1K,35,35,"....Since there was no Collusion, why was there an Investigation in the first place! Answer - Dirty Cops, Dems and Crooked Hillary!",https://pbs.twimg.com/profile_images/874276197357596672/kUuht00m_normal.jpg,Donald J. Trump,@realDonaldTrump,https://www.twitter.com/realDonaldTrump,9:24 AM,"Apr 15, 2019",1117826076774789126,https://www.twitter.com/realDonaldTrump/status/1117826076774789126
12.7K,"3,474",66.3K,64,64,"Statements are made about me by certain people in the Crazy Mueller Report, in itself written by 18 Angry Democrat Trump Haters, which are fabricated & totally untrue. Watch out for people that take so-called “notes,” when the notes never existed until needed. Because I never....",https://pbs.twimg.com/profile_images/874276197357596672/kUuht00m_normal.jpg,Donald J. Trump,@realDonaldTrump,https://www.twitter.com/realDonaldTrump,4:53 AM,"Apr 19, 2019",1119207303700471809,https://www.twitter.com/realDonaldTrump/status/1119207303700471809
10.1K,"1,334",54K,32,32,"Despite No Collusion, No Obstruction, The Radical Left Democrats do not want to go on to Legislate for the good of the people, but only to Investigate and waste time. This is costing our Country greatly, and will cost the Dems big time in 2020!",https://pbs.twimg.com/profile_images/874276197357596672/kUuht00m_normal.jpg,Donald J. Trump,@realDonaldTrump,https://www.twitter.com/realDonaldTrump,5:51 AM,"Apr 21, 2019",1119946842148622336,https://www.twitter.com/realDonaldTrump/status/1119946842148622336
"7,686",721,40.7K,30,30,"“Harley Davidson has struggled with Tariffs with the EU, currently paying 31%. They’ve had to move production overseas to try and offset some of that Tariff that they’ve been hit with which will rise to 66% in June of 2021.” @MariaBartiromo So unfair to U.S. We will Reciprocate!",https://pbs.twimg.com/profile_images/874276197357596672/kUuht00m_normal.jpg,Donald J. Trump,@realDonaldTrump,https://www.twitter.com/realDonaldTrump,4:04 AM,"Apr 23, 2019",,https://www.twitter.com/MariaBartiromo
