views,retweets,quotes,likes,bookmarks,tweet,profile_picture,name,profile_handle,profile_url,tweet_timing,tweet_date,tweet_id,tweet_url
14.9K,"2,160",84.4K,139,139,"Rarely has anybody deserved the death penalty more than the Boston Bomber, Dzhokhar Tsarnaev. The court agreed that this “was one of the worst domestic terrorist attacks since the 9/11 atrocities”. Yet the appellate court tossed out the death sentence. So many lives lost....",https://pbs.twimg.com/profile_images/874276197357596672/kUuht00m_normal.jpg,Donald J. Trump,@realDonaldTrump,https://www.twitter.com/realDonaldTrump,12:48 PM,"Aug 2, 2020",1290011569657610240,https://www.twitter.com/realDonaldTrump/status/1290011569657610240
16.6K,"2,549",107K,121,121,Homeland Security is not leaving Portland until local police complete cleanup of Anarchists and Agitators!,https://pbs.twimg.com/profile_images/874276197357596672/kUuht00m_normal.jpg,Donald J. Trump,@realDonaldTrump,https://www.twitter.com/realDonaldTrump,8:52 PM,"Jul 31, 2020",1289408673324777472,https://www.twitter.com/realDonaldTrump/status/1289408673324777472
20.5K,"2,611",89.6K,165,165,"Pelosi & Schumer blocked desperately needed unemployment payments, which is so terrible, especially since they fully understand that it was not the workers fault that they are unemployed, it’s the fault of China!",https://pbs.twimg.com/profile_images/874276197357596672/kUuht00m_normal.jpg,Donald J. Trump,@realDonaldTrump,https://www.twitter.com/realDonaldTrump,12:33 PM,"Jul 31, 2020",1289283091635122176,https://www.twitter.com/realDonaldTrump/status/1289283091635122176
13.6K,"2,297",71.6K,94,94,"Kate Brown, Governor of Oregon, isn’t doing her job. She must clear out, and in some cases arrest, the Anarchists & Agitators in Portland. If she can’t do it, the Federal Government will do it for her. We will not be leaving until there is safety!",https://pbs.twimg.com/profile_images/874276197357596672/kUuht00m_normal.jpg,Donald J. Trump,@realDonaldTrump,https://www.twitter.com/realDonaldTrump,6:20 AM,"Jul 30, 2020",1288826742539464707,https://www.twitter.com/realDonaldTrump/status/1288826742539464707
32.9K,60.6K,159.4K,"1,503",1.5K,"With Universal Mail-In Voting (not Absentee Voting, which is good), 2020 will be the most INACCURATE & FRAUDULENT Election in history. It will be a great embarrassment to the USA. Delay the Election until people can properly, securely and safely vote???",https://pbs.twimg.com/profile_images/874276197357596672/kUuht00m_normal.jpg,Donald J. Trump,@realDonaldTrump,https://www.twitter.com/realDonaldTrump,5:46 AM,"Jul 30, 2020",1288818160389558273,https://www.twitter.com/realDonaldTrump/status/1288818160389558273
23K,"4,852",111.7K,223,223,"The 2020 Election will be totally rigged if Mail-In Voting is allowed to take place, & everyone knows it. So much time is taken talking about foreign influence, but the same people won’t even discuss Mail-In election corruption. Look at Patterson, N.J. 20% of vote was corrupted!",https://pbs.twimg.com/profile_images/874276197357596672/kUuht00m_normal.jpg,Donald J. Trump,@realDonaldTrump,https://www.twitter.com/realDonaldTrump,1:51 PM,"Jul 26, 2020",1287490820669616128,https://www.twitter.com/realDonaldTrump/status/1287490820669616128
23.4K,"4,715",135.9K,234,234,"Obama, who wouldn’t even endorse Biden until everyone else was out of the primaries (and even then waited a long time!), is now making a commercial of support. Remember, I wouldn’t even be here if it weren’t for them. I wouldn’t be President. They did a terrible job!",https://pbs.twimg.com/profile_images/874276197357596672/kUuht00m_normal.jpg,Donald J. Trump,@realDonaldTrump,https://www.twitter.com/realDonaldTrump,9:29 AM,"Jul 23, 2020",1286337596206055432,https://www.twitter.com/realDonaldTrump/status/1286337596206055432
14.4K,"2,380",63.8K,69,69,"Mail-In Ballots will lead to massive electoral fraud and a rigged 2020 Election. Look at all of the cases and examples that are out there right now, with the Patterson, N.J., being the most recent example. Republicans, in particular, cannot let this happen!",https://pbs.twimg.com/profile_images/874276197357596672/kUuht00m_normal.jpg,Donald J. Trump,@realDonaldTrump,https://www.twitter.com/realDonaldTrump,4:41 PM,"Jul 2, 2020",1278836342609379328,https://www.twitter.com/realDonaldTrump/status/1278836342609379328
28.1K,"6,287",165.5K,263,263,"Since imposing a very powerful 10 year prison sentence on those that Vandalize Monuments, Statues etc., with many people being arrested all over our Country, the Vandalism has completely stopped. Thank you!",https://pbs.twimg.com/profile_images/874276197357596672/kUuht00m_normal.jpg,Donald J. Trump,@realDonaldTrump,https://www.twitter.com/realDonaldTrump,5:07 AM,"Jun 28, 2020",1277212069868318720,https://www.twitter.com/realDonaldTrump/status/1277212069868318720
52.8K,27.9K,203.1K,"1,547",1.5K,"RIGGED 2020 ELECTION: MILLIONS OF MAIL-IN BALLOTS WILL BE PRINTED BY FOREIGN COUNTRIES, AND OTHERS. IT WILL BE THE SCANDAL OF OUR TIMES!",https://pbs.twimg.com/profile_images/874276197357596672/kUuht00m_normal.jpg,Donald J. Trump,@realDonaldTrump,https://www.twitter.com/realDonaldTrump,4:16 AM,"Jun 22, 2020",1275024974579982336,https://www.twitter.com/realDonaldTrump/status/1275024974579982336
"6,912",959,40.1K,52,52,".....who was all washed up until I brought him back and gave him a chance, broke the law by releasing Classified Information (in massive amounts). He must pay a very big price for this, as others have before him. This should never to happen again!!!",https://pbs.twimg.com/profile_images/874276197357596672/kUuht00m_normal.jpg,Donald J. Trump,@realDonaldTrump,https://www.twitter.com/realDonaldTrump,7:46 AM,"Jun 20, 2020",1274353054117236738,https://www.twitter.com/realDonaldTrump/status/1274353054117236738
"2,963",168,18.5K,18,18,".@WVDOT will be awarded $12 million from @USDOT to help finish the Corridor H project between Kerens and Parsons, key to a booming economy in the Great State of West Virginia!",https://pbs.twimg.com/profile_images/874276197357596672/kUuht00m_normal.jpg,Donald J. Trump,@realDonaldTrump,https://www.twitter.com/realDonaldTrump,3:09 PM,"Jun 18, 2020",,https://www.twitter.com/WVDOT
12.2K,"2,824",64.9K,121,121,"I will be releasing a new list of Conservative Supreme Court Justice nominees, which may include some, or many of those already on the list, by September 1, 2020. If given the opportunity, I will only choose from this list, as in the past, a Conservative Supreme Court Justice...",https://pbs.twimg.com/profile_images/874276197357596672/kUuht00m_normal.jpg,Donald J. Trump,@realDonaldTrump,https://www.twitter.com/realDonaldTrump,10:24 AM,"Jun 18, 2020",1273667867523899394,https://www.twitter.com/realDonaldTrump/status/1273667867523899394
"7,944",654,43K,42,42,"...Based on decisions being rendered now, this list is more important than ever before (Second Amendment, Right to Life, Religous Liberty, etc.) – VOTE 2020!",https://pbs.twimg.com/profile_images/874276197357596672/kUuht00m_normal.jpg,Donald J. Trump,@realDonaldTrump,https://www.twitter.com/realDonaldTrump,10:24 AM,"Jun 18, 2020",1273667868362768386,https://www.twitter.com/realDonaldTrump/status/1273667868362768386
20K,"9,621",95.6K,361,361,These horrible & politically charged decisions coming out of the Supreme Court are shotgun blasts into the face of people that are proud to call themselves Republicans or Conservatives. We need more Justices or we will lose our 2nd. Amendment & everything else. Vote Trump 2020!,https://pbs.twimg.com/profile_images/874276197357596672/kUuht00m_normal.jpg,Donald J. Trump,@realDonaldTrump,https://www.twitter.com/realDonaldTrump,8:08 AM,"Jun 18, 2020",1273633632742191106,https://www.twitter.com/realDonaldTrump/status/1273633632742191106
"8,764",882,46.3K,53,53,"“It’s a terrible situation, and I blame the leaders of those cities. The President of the United States has fought through a lot of different things since he’s been in office, and to be honest with you, he’s done one hell of a job.” @HerschelWalker @seanhannity @FoxNews",https://pbs.twimg.com/profile_images/874276197357596672/kUuht00m_normal.jpg,Donald J. Trump,@realDonaldTrump,https://www.twitter.com/realDonaldTrump,5:54 AM,"Jun 18, 2020",,https://www.twitter.com/HerschelWalker
16.5K,"5,411",92.3K,352,352,"Wacko John Bolton’s “exceedingly tedious”(New York Times) book is made up of lies & fake stories. Said all good about me, in print, until the day I fired him. A disgruntled boring fool who only wanted to go to war. Never had a clue, was ostracized & happily dumped. What a dope!",https://pbs.twimg.com/profile_images/874276197357596672/kUuht00m_normal.jpg,Donald J. Trump,@realDonaldTrump,https://www.twitter.com/realDonaldTrump,9:10 PM,"Jun 17, 2020",1273468029712707584,https://www.twitter.com/realDonaldTrump/status/1273468029712707584
"4,547",168,26.2K,22,22,"Congratulations to @KarenHandel on running a great race and terrific primary victory - 75%, despite tough competition. Previously beat Jon Ossoff who, after his 2017 Congressional failure, is now running against a GREAT Senator, David @PerdueSenate...",https://pbs.twimg.com/profile_images/874276197357596672/kUuht00m_normal.jpg,Donald J. Trump,@realDonaldTrump,https://www.twitter.com/realDonaldTrump,1:04 PM,"Jun 11, 2020",,https://www.twitter.com/KarenHandel
11K,716,69.8K,46,46,"Great work in the Republican Senate on some big nominees. Still 154 to go, hope they don’t adjourn until the job is done! @senatemajldr",https://pbs.twimg.com/profile_images/874276197357596672/kUuht00m_normal.jpg,Donald J. Trump,@realDonaldTrump,https://www.twitter.com/realDonaldTrump,11:34 AM,"Jun 9, 2020",1270424134430994437,https://www.twitter.com/realDonaldTrump/status/1270424134430994437
"8,181",709,56.3K,50,50,"...to the UNITED STATES! We have now brought more than 40 American hostages and detainees back home since I took office. Thank you to Iran, it shows a deal is possible!",https://pbs.twimg.com/profile_images/874276197357596672/kUuht00m_normal.jpg,Donald J. Trump,@realDonaldTrump,https://www.twitter.com/realDonaldTrump,3:28 PM,"Jun 4, 2020",1268670884501426182,https://www.twitter.com/realDonaldTrump/status/1268670884501426182
32.2K,15K,166.3K,815,815,"My Admin has done more for the Black Community than any President since Abraham Lincoln. Passed Opportunity Zones with @SenatorTimScott, guaranteed funding for HBCU’s, School Choice, passed Criminal Justice Reform, lowest Black unemployment, poverty, and crime rates in history…",https://pbs.twimg.com/profile_images/874276197357596672/kUuht00m_normal.jpg,Donald J. Trump,@realDonaldTrump,https://www.twitter.com/realDonaldTrump,11:27 AM,"Jun 2, 2020",,https://www.twitter.com/SenatorTimScott
20.5K,"2,652",92.2K,187,187,“These were the people that trashed Seattle years ago. Who’s paying for these people. I was appalled that 13 of Joe Biden’s staff were donating money to bail people out in Minneapolis. They should have stayed in jail until this is over (and beyond).” @newtgingrich @foxandfriends,https://pbs.twimg.com/profile_images/874276197357596672/kUuht00m_normal.jpg,Donald J. Trump,@realDonaldTrump,https://www.twitter.com/realDonaldTrump,5:27 AM,"Jun 1, 2020",,https://www.twitter.com/newtgingrich
37.8K,"8,920",178.6K,507,507,"Twitter is doing nothing about all of the lies & propaganda being put out by China or the Radical Left Democrat Party. They have targeted Republicans, Conservatives & the President of the United States. Section 230 should be revoked by Congress. Until then, it will be regulated!",https://pbs.twimg.com/profile_images/874276197357596672/kUuht00m_normal.jpg,Donald J. Trump,@realDonaldTrump,https://www.twitter.com/realDonaldTrump,4:10 AM,"May 29, 2020",1266326065833824257,https://www.twitter.com/realDonaldTrump/status/1266326065833824257
36.8K,10.9K,145.5K,679,679,".@Twitter is now interfering in the 2020 Presidential Election. They are saying my statement on Mail-In Ballots, which will lead to massive corruption and fraud, is incorrect, based on fact-checking by Fake News CNN and the Amazon Washington Post....",https://pbs.twimg.com/profile_images/874276197357596672/kUuht00m_normal.jpg,Donald J. Trump,@realDonaldTrump,https://www.twitter.com/realDonaldTrump,4:40 PM,"May 26, 2020",,https://www.twitter.com/twitter
17.7K,"1,874",86.8K,90,90,"I hope all Republican House Members vote NO on FISA until such time as our Country is able to determine how and why the greatest political, criminal, and subversive scandal in USA history took place!",https://pbs.twimg.com/profile_images/874276197357596672/kUuht00m_normal.jpg,Donald J. Trump,@realDonaldTrump,https://www.twitter.com/realDonaldTrump,4:21 PM,"May 26, 2020",1265422768625123335,https://www.twitter.com/realDonaldTrump/status/1265422768625123335
11.8K,"1,118",64.4K,92,92,"Sleepy Joe Biden (mostly his reps.) went crazy when I banned, in late January, people coming in from China. He called me “xenophobic” & then went equally “nuts” when we let in 44,000 people - until he was told they were American citizens coming home. He later apologized!",https://pbs.twimg.com/profile_images/874276197357596672/kUuht00m_normal.jpg,Donald J. Trump,@realDonaldTrump,https://www.twitter.com/realDonaldTrump,1:00 PM,"May 25, 2020",1265009852516110336,https://www.twitter.com/realDonaldTrump/status/1265009852516110336
13.6K,"1,793",73K,92,92,"Do nothing A.G. of the Great State of Michigan, Dana Nessel, should not be taking her anger and stupidity out on Ford Motor - they might get upset with you and leave the state, like so many other companies have - until I came along and brought business back to Michigan. JOBS!",https://pbs.twimg.com/profile_images/874276197357596672/kUuht00m_normal.jpg,Donald J. Trump,@realDonaldTrump,https://www.twitter.com/realDonaldTrump,8:20 PM,"May 21, 2020",1263671099000315907,https://www.twitter.com/realDonaldTrump/status/1263671099000315907
34.2K,"4,671",172K,301,301,"China is on a massive disinformation campaign because they are desperate to have Sleepy Joe Biden win the presidential race so they can continue to rip-off the United States, as they have done for decades, until I came along!",https://pbs.twimg.com/profile_images/874276197357596672/kUuht00m_normal.jpg,Donald J. Trump,@realDonaldTrump,https://www.twitter.com/realDonaldTrump,6:37 PM,"May 20, 2020",1263282623939477511,https://www.twitter.com/realDonaldTrump/status/1263282623939477511
20.8K,"3,021",107K,294,294,"Intelligence has just reported to me that I was correct, and that they did NOT bring up the CoronaVirus subject matter until late into January, just prior to my banning China from the U.S. Also, they only spoke of the Virus in a very non-threatening, or matter of fact, manner...",https://pbs.twimg.com/profile_images/874276197357596672/kUuht00m_normal.jpg,Donald J. Trump,@realDonaldTrump,https://www.twitter.com/realDonaldTrump,1:18 PM,"May 3, 2020",1257041819097092096,https://www.twitter.com/realDonaldTrump/status/1257041819097092096
"6,741","1,095",36K,71,71,"No, I think Amash would make a wonderful candidate, especially since he is way behind in his district and has no chance of maintaining his Congressional seat. He almost always votes for the Do Nothing Dems anyway. I like him even more than Jill Stein!Joe Walsh: Justin Amash’s campaign will help Trump win - The Washington Post https://washingtonpost.com/outlook/2020/04/29/amash-libertarian-reelect-trump/…",https://pbs.twimg.com/profile_images/874276197357596672/kUuht00m_normal.jpg,Donald J. Trump,@realDonaldTrump,https://www.twitter.com/realDonaldTrump,"Apr 29, 20207:55 AM","Apr 29, 2020",1255510996623527936,https://www.twitter.com/realDonaldTrump/status/1255510996623527936
14.8K,"3,623",96.5K,193,193,"I work from early in the morning until late at night, haven’t left the White House in many months (except to launch Hospital Ship Comfort) in order to take care of Trade Deals, Military Rebuilding etc., and then I read a phony story in the failing @nytimes about my work....",https://pbs.twimg.com/profile_images/874276197357596672/kUuht00m_normal.jpg,Donald J. Trump,@realDonaldTrump,https://www.twitter.com/realDonaldTrump,11:28 AM,"Apr 26, 2020",,https://www.twitter.com/nytimes
16.2K,"2,618",119.4K,186,186,"I will never let our Post Office fail. It has been mismanaged for years, especially since the advent of the internet and modern-day technology. The people that work there are great, and we’re going to keep them happy, healthy, and well!",https://pbs.twimg.com/profile_images/874276197357596672/kUuht00m_normal.jpg,Donald J. Trump,@realDonaldTrump,https://www.twitter.com/realDonaldTrump,12:08 PM,"Apr 24, 2020",1253762674137149446,https://www.twitter.com/realDonaldTrump/status/1253762674137149446
14.1K,"1,827",75.8K,119,119,"The @nytimes story is a Fake, just like the “paper” itself. I was criticized for moving too fast when I issued the China Ban, long before most others wanted to do so. @SecAzar told me nothing until later, and Peter Navarro memo was same as Ban (see his statements). Fake News!",https://pbs.twimg.com/profile_images/874276197357596672/kUuht00m_normal.jpg,Donald J. Trump,@realDonaldTrump,https://www.twitter.com/realDonaldTrump,7:08 PM,"Apr 12, 2020",,https://www.twitter.com/nytimes
22.3K,"3,300",123.8K,134,134,"Nancy Pelosi and the Democrats delayed the Workers Help/Stimulus Bill by over a week, trying to add real “junk” into the Bill. Got some bad things, having nothing to do with those affected by the Virus, included. Republicans need their votes until we WIN BACK THE HOUSE IN 2020!",https://pbs.twimg.com/profile_images/874276197357596672/kUuht00m_normal.jpg,Donald J. Trump,@realDonaldTrump,https://www.twitter.com/realDonaldTrump,4:17 AM,"Mar 30, 2020",1244584449309892609,https://www.twitter.com/realDonaldTrump/status/1244584449309892609
12.7K,27.9K,82.1K,"1,085",1K,"“President Trump is a ratings hit. Since reviving the daily White House briefing Mr. Trump and his coronavirus updates have attracted an average audience of 8.5 million on cable news, roughly the viewership of the season finale of ‘The Bachelor.’ Numbers are continuing to rise...",https://pbs.twimg.com/profile_images/874276197357596672/kUuht00m_normal.jpg,Donald J. Trump,@realDonaldTrump,https://www.twitter.com/realDonaldTrump,10:48 AM,"Mar 29, 2020",1244320570315018240,https://www.twitter.com/realDonaldTrump/status/1244320570315018240
12.8K,"1,956",75.8K,94,94,"I will be doing a News Conference live from the @WhiteHouse at 5:00 P.M. (Eastern) to discuss the mtg of the G20 Leaders that took place this morning at 7:55 A.M. by World Teleconference. Also, my 12:00 P.M. Teleconference call w/50 Governors, plus Territories, will be discussed.",https://pbs.twimg.com/profile_images/874276197357596672/kUuht00m_normal.jpg,Donald J. Trump,@realDonaldTrump,https://www.twitter.com/realDonaldTrump,8:36 AM,"Mar 26, 2020",,https://www.twitter.com/WhiteHouse
20.1K,"2,296",106.2K,113,113,"The New York Times changed headlines 3 times in order to satisfy the Radical Left. What should have been a good story got “worse & worse”, until the headline alone made it very unfair. Fake & Corrupt News that is very dangerous for our Country!",https://pbs.twimg.com/profile_images/874276197357596672/kUuht00m_normal.jpg,Donald J. Trump,@realDonaldTrump,https://www.twitter.com/realDonaldTrump,7:28 AM,"Mar 23, 2020",1242095933296443395,https://www.twitter.com/realDonaldTrump/status/1242095933296443395
14.3K,"2,489",83.3K,81,81,"Seems totally ridiculous that our government, and indeed Country, cannot ask a basic question of Citizenship in a very expensive, detailed and important Census, in this case for 2020. I have asked the lawyers if they can delay the Census, no matter how long, until the.....",https://pbs.twimg.com/profile_images/874276197357596672/kUuht00m_normal.jpg,Donald J. Trump,@realDonaldTrump,https://www.twitter.com/realDonaldTrump,10:37 AM,"Jun 27, 2019",1144298731887628288,https://www.twitter.com/realDonaldTrump/status/1144298731887628288
"7,392",419,40.3K,23,23,"Ever since the passage of the Super Predator Crime Bill, pushed hard by @JoeBiden, together with Bill and Crooked Hillary Clinton, which inflicted great pain on many, but especially the African American Community, Democrats have tried and failed to pass Criminal Justice Reform...",https://pbs.twimg.com/profile_images/874276197357596672/kUuht00m_normal.jpg,Donald J. Trump,@realDonaldTrump,https://www.twitter.com/realDonaldTrump,4:46 PM,"Jun 26, 2019",,https://www.twitter.com/JoeBiden
11.1K,"4,064",86.6K,99,99,"....invited Megan or the team, but I am now inviting the TEAM, win or lose. Megan should never disrespect our Country, the White House, or our Flag, especially since so much has been done for her & the team. Be proud of the Flag that you wear. The USA is doing GREAT!",https://pbs.twimg.com/profile_images/874276197357596672/kUuht00m_normal.jpg,Donald J. Trump,@realDonaldTrump,https://www.twitter.com/realDonaldTrump,7:42 AM,"Jun 26, 2019",1143892329582997505,https://www.twitter.com/realDonaldTrump/status/1143892329582997505
"8,884","1,042",44.3K,44,44,"Since Election Day 2016, Stocks up almost 50%, Stocks gained 9.2 Trillion Dollars in value, and more than 5,000,000 new jobs added to the Economy. @LouDobbs If our opponent had won, there would have been a market crash, plain and simple! @TuckerCarlson @seanhannity @IngrahamAngle",https://pbs.twimg.com/profile_images/874276197357596672/kUuht00m_normal.jpg,Donald J. Trump,@realDonaldTrump,https://www.twitter.com/realDonaldTrump,5:12 PM,"Jun 19, 2019",,https://www.twitter.com/LouDobbs
"9,298","2,663",50K,179,179,"The Trump Economy is setting records, and has a long way up to go....However, if anyone but me takes over in 2020 (I know the competition very well), there will be a Market Crash the likes of which has not been seen before! KEEP AMERICA GREAT",https://pbs.twimg.com/profile_images/874276197357596672/kUuht00m_normal.jpg,Donald J. Trump,@realDonaldTrump,https://www.twitter.com/realDonaldTrump,6:44 AM,"Jun 15, 2019",1139891393252474880,https://www.twitter.com/realDonaldTrump/status/1139891393252474880
"8,031",932,46.2K,27,27,"“With over a 50% Approval Rating at this point in his Presidency, analysts believe re-election in 2020 looks (very) promising!” @OANN  Hey, we have accomplished more than any President in the first 2 1/2 years, WHY NOT?",https://pbs.twimg.com/profile_images/874276197357596672/kUuht00m_normal.jpg,Donald J. Trump,@realDonaldTrump,https://www.twitter.com/realDonaldTrump,4:44 AM,"Jun 15, 2019",,https://www.twitter.com/OANN
"5,990",309,34.3K,18,18,"Unrelated to Russia, Russia, Russia (although the Radical Left doesn’t use the name Russia anymore since the issuance of the Mueller Report), House Committee now plays the seldom used “Contempt” card on our great A.G. & Sec. of Commerce - this time on the Census. Dems play a.....",https://pbs.twimg.com/profile_images/874276197357596672/kUuht00m_normal.jpg,Donald J. Trump,@realDonaldTrump,https://www.twitter.com/realDonaldTrump,3:51 AM,"Jun 13, 2019",1139123048748081153,https://www.twitter.com/realDonaldTrump/status/1139123048748081153
10.2K,"1,411",51.7K,35,35,"When will the Failing New York Times admit that their front page story on the  the new Mexico deal at the Border is a FRAUD and nothing more than a badly reported “hit job” on me, something that has been going on since the first day I announced for the presidency! Sick Journalism",https://pbs.twimg.com/profile_images/874276197357596672/kUuht00m_normal.jpg,Donald J. Trump,@realDonaldTrump,https://www.twitter.com/realDonaldTrump,4:09 AM,"Jun 10, 2019",1138040393033895936,https://www.twitter.com/realDonaldTrump/status/1138040393033895936
14.7K,"2,206",82.5K,70,70,"Nervous Nancy Pelosi is a disgrace to herself and her family for having made such a disgusting statement, especially since I was with foreign leaders overseas. There is no evidence for such a thing to have been said. Nervous Nancy & Dems are getting Zero work done in Congress....",https://pbs.twimg.com/profile_images/874276197357596672/kUuht00m_normal.jpg,Donald J. Trump,@realDonaldTrump,https://www.twitter.com/realDonaldTrump,9:57 AM,"Jun 7, 2019",1137040971311353856,https://www.twitter.com/realDonaldTrump/status/1137040971311353856
14.7K,"2,206",82.5K,70,70,"Nervous Nancy Pelosi is a disgrace to herself and her family for having made such a disgusting statement, especially since I was with foreign leaders overseas. There is no evidence for such a thing to have been said. Nervous Nancy & Dems are getting Zero work done in Congress....",https://pbs.twimg.com/profile_images/874276197357596672/kUuht00m_normal.jpg,Donald J. Trump,@realDonaldTrump,https://www.twitter.com/realDonaldTrump,9:57 AM,"Jun 7, 2019",1137040971311353856,https://www.twitter.com/realDonaldTrump/status/1137040971311353856
20.8K,11.5K,101.2K,215,215,"On June 10th, the United States will impose a 5% Tariff on all goods coming into our Country from Mexico, until such time as illegal migrants coming through Mexico, and into our Country, STOP. The Tariff will gradually increase until the Illegal Immigration problem is remedied,..",https://pbs.twimg.com/profile_images/874276197357596672/kUuht00m_normal.jpg,Donald J. Trump,@realDonaldTrump,https://www.twitter.com/realDonaldTrump,4:30 PM,"May 30, 2019",1134240653926232064,https://www.twitter.com/realDonaldTrump/status/1134240653926232064
